{
  "schemaVersion": "1.0.0",
  "generatedAt": "2026-10-17T14:31:29Z",
  "project": "TRAMA",
  "status": "CURRENT",
  "currentPhase": {
    "id": "R4",
    "name": "Esperienza professionale guidata",
    "status": "PLANNED",
    "gateRefs": []
  },
  "activeCapabilities": [
    {
      "id": "DOS-A1",
      "label": "Integrazione operativa automatizzata",
      "ownerDomain": "Docente OS",
      "state": "DEFERRED",
      "humanReview": "PENDING",
      "runtimeState": "DEFERRED",
      "maturityAreaRef": "docente-os",
      "dependencyRefs": [],
      "gateRefs": [],
      "evidenceRefs": [
        "EV-SOURCE-ECOSYSTEM-STATUS"
      ],
      "lastSignificantChange": null,
      "sourceRef": "status/ecosystem-status.json",
      "sourceUpdatedAt": "2026-09-25"
    },
    {
      "id": "R4-P1",
      "label": "Officina materiali specialistica",
      "ownerDomain": "TRAMA",
      "state": "PLANNED",
      "humanReview": "PENDING",
      "runtimeState": null,
      "maturityAreaRef": "governance",
      "dependencyRefs": [],
      "gateRefs": [],
      "evidenceRefs": [
        "EV-SOURCE-ECOSYSTEM-STATUS"
      ],
      "lastSignificantChange": null,
      "sourceRef": "status/ecosystem-status.json",
      "sourceUpdatedAt": "2026-09-25"
    },
    {
      "id": "TRAMA-SA-01",
      "label": "TypeSafe semantic assurance pilot",
      "ownerDomain": "TRAMA",
      "state": "ACTIVE",
      "humanReview": "PENDING",
      "runtimeState": null,
      "maturityAreaRef": "governance",
      "dependencyRefs": [],
      "gateRefs": [],
      "evidenceRefs": [
        "EV-SOURCE-ECOSYSTEM-STATUS"
      ],
      "lastSignificantChange": null,
      "sourceRef": "status/ecosystem-status.json",
      "sourceUpdatedAt": "2026-09-25"
    },
    {
      "id": "TRAMA-BRAND",
      "label": "Nome e marchio definitivi",
      "ownerDomain": "TRAMA",
      "state": "PLANNED",
      "humanReview": "PENDING",
      "runtimeState": null,
      "maturityAreaRef": "governance",
      "dependencyRefs": [],
      "gateRefs": [],
      "evidenceRefs": [
        "EV-SOURCE-ECOSYSTEM-STATUS"
      ],
      "lastSignificantChange": null,
      "sourceRef": "status/ecosystem-status.json",
      "sourceUpdatedAt": "2026-09-25"
    }
  ],
  "canonicalDecisions": [
    {
      "id": "TRAMA-ADR-001",
      "title": "TRAMA come livello di governo comune",
      "status": "APPROVED",
      "date": "2026-09-21",
      "scope": [
        "TRAMA",
        "Arena",
        "Atlas",
        "Docente OS"
      ],
      "decision": "TRAMA governa decisioni e contratti trasversali senza diventare una quarta applicazione.",
      "humanControlImpact": "NONE",
      "supersedes": []
    },
    {
      "id": "TRAMA-ADR-002",
      "title": "Arena rimane la fonte curricolare autorevole",
      "status": "APPROVED",
      "date": "2026-09-21",
      "scope": [
        "Arena",
        "Atlas",
        "Docente OS"
      ],
      "decision": "Atlas può pubblicare il curricolo ma non sostituisce Arena nel trasferimento verso Docente OS.",
      "humanControlImpact": "PRESERVED",
      "supersedes": []
    },
    {
      "id": "TRAMA-ADR-003",
      "title": "Base di conoscenza federata",
      "status": "APPROVED",
      "date": "2026-09-21",
      "scope": [
        "TRAMA",
        "Arena",
        "Atlas",
        "Docente OS",
        "Drive"
      ],
      "decision": "Ogni dominio conserva una sola fonte autorevole; Drive ospita documenti umani e copie dichiarate, non una replica tecnica completa.",
      "humanControlImpact": "PRESERVED",
      "supersedes": []
    },
    {
      "id": "TRAMA-ADR-004",
      "title": "DOS-A1 resta differita",
      "status": "APPROVED",
      "date": "2026-09-21",
      "scope": [
        "Docente OS"
      ],
      "decision": "La capacità operativa automatizzata DOS-A1 rimane RUNTIME_DEFERRED fino a nuova autorizzazione esplicita.",
      "humanControlImpact": "PRESERVED",
      "supersedes": []
    },
    {
      "id": "TRAMA-ADR-005",
      "title": "TRAMA resta un nome di lavoro",
      "status": "APPROVED",
      "date": "2026-09-21",
      "scope": [
        "TRAMA"
      ],
      "decision": "Il nome non è presentato come marchio definitivo prima delle verifiche giuridiche e digitali.",
      "humanControlImpact": "NONE",
      "supersedes": []
    },
    {
      "id": "TRAMA-ADR-007",
      "title": "Atlas come superficie pubblica e didattica di TRAMA",
      "status": "APPROVED",
      "date": "2026-09-21",
      "scope": [
        "TRAMA",
        "Arena",
        "Atlas",
        "Docente OS"
      ],
      "decision": "Atlas è approvato come superficie pubblica e didattica dell'ecosistema per curriculum pubblico, Student Learning Hub, biblioteca educativa e Smart Views. Arena resta l'unica autorità curricolare; Atlas è autorevole esclusivamente per identità, versione e stato delle proprie risorse, pagine e pubblicazioni. L'approvazione di governance non autorizza da sola nuove capacità runtime.",
      "humanControlImpact": "PRESERVED",
      "supersedes": []
    },
    {
      "id": "TRAMA-ADR-008",
      "title": "Pubblicazione esplicita Docente OS verso Atlas",
      "status": "APPROVED",
      "date": "2026-09-21",
      "scope": [
        "Atlas",
        "Docente OS"
      ],
      "decision": "È approvato il contratto di pubblicazione didattica Docente OS → Atlas basato su anteprima e conferma esplicita del docente, LessonPublicationManifest minimizzato e versionato, binding autorevole ad Arena e PublicationReceipt Atlas distinta. Versionamento, idempotenza, reversibilità, visibilità/minimizzazione, diritti/licenze e WCAG 2.2 AA restano gate obbligatori. Il runtime resta NOT_IMPLEMENTED / NOT_AUTHORIZED_FOR_RUNTIME fino a distinta implementazione e review.",
      "humanControlImpact": "STRENGTHENED",
      "supersedes": []
    },
    {
      "id": "TRAMA-ADR-009",
      "title": "TypeSafe come capacità opzionale di assurance semantica",
      "status": "PROPOSED",
      "date": "2026-09-21",
      "scope": [
        "TRAMA",
        "Arena",
        "Atlas",
        "Docente OS"
      ],
      "decision": "TypeSafe è proposto come provider opzionale di giudizi semantici tipizzati e probabilistici, esclusivamente advisory-only. Regole deterministiche, autorizzazioni, stato ed effetti restano nel codice e nelle autorità esistenti; il pilota TRAMA-SA-01 usa soltanto dati sintetici, pubblici o minimizzati e mantiene revisione umana di ogni caso. Nessun output TypeSafe autorizza pubblicazione, adozione, modifica o attivazione di DOS-A1. Un eventuale uso runtime richiede una decisione TRAMA separata.",
      "humanControlImpact": "PRESERVED",
      "supersedes": []
    },
    {
      "id": "TRAMA-ADR-010",
      "title": "Atlas integrale e separazione dell'Officina materiali",
      "status": "APPROVED",
      "date": "2026-09-22",
      "scope": [
        "TRAMA",
        "Arena",
        "Atlas",
        "Docente OS"
      ],
      "decision": "Atlas resta il visualizzatore/navigatore intelligente integrale del curricolo e include biblioteca e Student Learning Hub senza ridursi a repository. Docente OS costruisce il contesto e il brief ma non è il motore grafico generalista; una Officina materiali specialistica può produrre proposte usando anche pattern e risorse Atlas. Si applica riusa-prima-di-generare e ogni adozione/pubblicazione resta una decisione esplicita del docente. Nessun runtime è autorizzato da questa decisione di governance.",
      "humanControlImpact": "STRENGTHENED",
      "supersedes": []
    },
    {
      "id": "TRAMA-ADR-011",
      "title": "Educazione civica: separazione tra quadro istituzionale e attuazione di classe",
      "status": "APPROVED",
      "date": "2026-09-22",
      "scope": [
        "TRAMA",
        "Arena",
        "Atlas",
        "Docente OS"
      ],
      "decision": "Arena governa il quadro istituzionale annuale approvato di Educazione civica; Docente OS governa progettazione, conferma docente, attività condivise e consuntivo di classe; Atlas mostra soltanto il quadro approvato. Le quote per primaria e secondaria di primo grado sono annuali e il totale approvabile è almeno 33 ore; le attività condivise emergono dalla progettazione di classe e contano una sola volta nel totale. Nessun valore settimanale locale sostituisce il quadro Arena. L'approvazione di governance non autorizza da sola alcuna capacità runtime.",
      "humanControlImpact": "STRENGTHENED",
      "supersedes": []
    },
    {
      "id": "TRAMA-ADR-012",
      "title": "Feedback percepibile obbligatorio per ogni write user-initiated",
      "status": "PROPOSED",
      "date": "2026-09-22",
      "scope": [
        "TRAMA",
        "Arena",
        "Atlas",
        "Docente OS"
      ],
      "decision": "È proposto TRAMA-PW-01 come contratto trasversale: ogni write user-initiated deve rendere percepibili intenzione, stato in corso quando asincrono, esito esplicito, stato risultante e prossimo passo quando utile; successo ed errore devono essere accessibili e verificati da evidenza automatica legata alla singola write. Nessuna persistenza, navigazione o trasmissione equivale ad approvazione implicita. L'adozione non autorizza nuove write, runtime cross-product o DOS-A1.",
      "humanControlImpact": "STRENGTHENED",
      "supersedes": []
    },
    {
      "id": "TRAMA-ADR-013",
      "title": "Substrato Git-first per la pubblicazione degli asset Atlas",
      "status": "PROPOSED",
      "date": "2026-09-23",
      "scope": [
        "TRAMA",
        "Atlas",
        "Docente OS"
      ],